{
  "decision_id": "expert-huv-routine-lab-phase1-pending",
  "procedure_code": "PHASE1_ROUTINE_LAB_SET",
  "procedure_code_system": "HUV",
  "procedure_name": "Rutin lab faz-1 seti (12 kod)",
  "verdict": "approve_shadow_scope",
  "include_diagnoses": [],
  "exclude_diagnoses": [],
  "exceptions": [
    "Tek tek kod bazında veto hakkı saklıdır.",
    "03.10886 ve 24.x bu kararın dışında."
  ],
  "decision_if_missing_diagnosis": "PASS",
  "rationale": "UZMAN DOLDURACAK: Aşağıdaki 12 HUV kodunun toplu olarak not_required shadow pilot'a alınması uygun mu? Kodlar: 34.53153, 34.01511, 34.16460, 34.94074, 34.58287, 34.39563, 34.22047, 34.85618, 34.76860, 34.35788, 34.96490, 34.94376",
  "source_refs": [
    {
      "label": "LAB_SHADOW_POLICY_PROPOSAL.json",
      "url_or_doc_id": "data/handoffs/review_reduction_lab_not_required_shadow_proposal_20260721/LAB_SHADOW_POLICY_PROPOSAL.json",
      "list_version": ""
    }
  ],
  "confidence": "medium",
  "valid_from": null,
  "valid_to": null,
  "shadow_pilot_approved": false,
  "live_apply_approved": false,
  "decided_by": {
    "name": "UZMAN_ADI",
    "role": "medikal-policy",
    "organization": "Vakıf",
    "authority_id": ""
  },
  "decided_at": "2026-07-21T00:00:00Z",
  "notes": "Toplu form; istenirse kod bazlı formlar da doldurulabilir. Canlı apply yok.",
  "related_proposal_path": "data/handoffs/review_reduction_lab_not_required_shadow_proposal_20260721"
}